{
  "type": "state_update",
  "object_id": "keys",
  "location": {
    "spot": null,
    "position": [
      0,
      0.6,
      0
    ],
    "area": null,
    "near": "hub",
    "distance_class": "mid"
  },
  "precision": "proximity",
  "status": "roaming",
  "home_spot": null,
  "last_seen_t": 1761350400.12,
  "source": "ble",
  "t": 1761350400.12
}
